lemma,definition,count
one,The represented by the ; the numerical value equal to that cardinal number.,4126070011
may,To be strong; to have power (over).,2869311688
time,The inevitable progression into the future with the passing of present and past events.,2865795390
state,A condition; a set of circumstances applying at any given time.,2767847171
year,A period of time akin to the time taken for the Earth to undergo a full cycle of seasons.,2572846270
new,"made, or created.",2424191987
two,A numerical value equal to 2; this many dots (••).,2052142232
also,In addition; besides; as well; further; too.,2044009341
first,Preceding all others of a series or kind; the ordinal of one; earliest.,1818541242
see,"To perceive or detect someone or something with the eyes, or as if by sight.",1718186042
made,A grub or maggot.,1705673992
work,Employment.,1669910266
case,"An actual event, situation, or fact.",1572219692
day,The time when the Sun is above the horizon and it lights the sky.,1496855505
part,A portion; a component.,1457682285
find,To locate,1410382493
well,"Accurately, competently, satisfactorily.",1379164686
great,Taking much space; large.,1310364140
system,A group or set of related things that operate together as a complex whole.,1308057442
many,"before a countable noun: A large, indefinite number of.",1303616636
service,An act of being of assistance to someone.,1286787903
must,To do as a requirement; .,1266782750
like,"To enjoy, be pleased by; favor; be in favor of.",1246923993
make,To create.,1243662372
use,The act of using.,1214893022
right,"Designating the side of the body which is positioned to the east if one is facing north, the side on which the heart is not located in most humans. This arrow points to the reader's right: →",1193721823
number,Quantity.,1190356217
way,To do with a place or places.,1178181634
people,a body of persons considered generally or collectively; a group of two or more persons.,1175560312
general,"Including or involving every part or member of a given or implied entity, whole, etc.; common to all, universal.",1171335900
law,"The body of binding rules and regulations, customs and standards established in a community by its legislative and judicial authorities.",1167615020
act,"Something done, a deed.",1155556060
life,"The state of organisms preceding their death, characterized by biological processes such as metabolism and reproduction and distinguishing them from inanimate objects; the state of being alive and living.",1122952571
even,Flat and level.,1093807428
far,Distant; remote in space.,1088408705
much,A large amount of.,1085408945
section,A cutting; a part cut out from the rest of something.,1060273892
order,"Arrangement, disposition, or sequence.",1054119270
company,A team; a group of people who work together professionally.,1039980034
court,"An enclosed space; a courtyard; an uncovered area shut in by the walls of a building, or by different buildings; also, a space opening from a street and nearly surrounded by houses; a blind alley.",1029779404
water,"A inorganic compound (of molecular formula H2O) found at room temperature and pressure as a clear liquid; it is present naturally as rain, and found in rivers, lakes and seas; its solid form is ice and its gaseous form is steam.",1028091813
three,A numerical value after two and before four. Represented in Arabic digits as 3; this many dots (•••).,1019575454
government,"The body with the power to make and/or enforce laws to control a country, land area, people or organization.",1000837084
school,An institution dedicated to teaching and learning; an educational institution.,980791630
public,Able to be known or seen by everyone; happening without concealment; open to general view.,968656763
man,An adult male human.,965919596
child,"A person who has not yet reached adulthood, whether natural (puberty), cultural (initiation), or legal (majority).",963484533
place,An area; somewhere within an area.,949064075
however,"Nevertheless; yet, still; in spite of that.",948021260
power,The ability to do or undergo something.,936296682
country,"The territory of a nation; a sovereign state or a region once independent and still distinct in institutions, language, etc.",922443682
area,A measure of the extent of a surface; it is measured in square units.,919723222
study,"To review materials already learned in order to make sure one does not forget them, usually in preparation for an examination.",919246978
point,A small dot or mark.,916440033
long,Having much distance in space from one end to the other.,910855454
take,"To get into one's hands, possession or control, with or without force.",906639028
house,A structure built or serving as an abode of human beings.,903384038
say,To pronounce.,888737147
result,"To proceed, spring up or rise, as a consequence, from facts, arguments, premises, combination of circumstances, consultation, thought or endeavor.",875594859
member,One who belongs to a group.,871019716
high,"Physically elevated, extending above a base or average level",866891928
report,"To relate details of (an event or incident); to recount, describe (something). {{defdate|from }}",863400827
know,To perceive the truth or factuality of; to be certain of; to be certain that.,860271947
mean,To intend.,855036431
doe,"A female deer; also used of similar animals such as antelope (less commonly a goat, as is also used).",853881572
group,A number of things or persons being in some relation to one another.,852719850
world,"The subjective human experience, regarded collectively; human collective existence; existence in general; the reality we live in.",851801568
value,The quality that renders something desirable or valuable; worth.,839567833
person,An individual who has been granted personhood; usually a human being.,839282951
present,"Relating to now, for the time being; current.",832760479
city,"A large settlement, bigger than a town; sometimes with a specific legal definition, depending on the place.",829034645
line,"A path through two or more points (compare ‘segment’); a continuous mark, including as made by a pen; any path, curved or straight.",821934564
effect,The result or outcome of a cause.,820170535
change,To become something different.,814991421
within,"In the inner part, spatially; physically inside.",813768762
hand,"The part of the forelimb below the forearm or wrist in a human, and the corresponding part in many other animals.",804254910
question,"A worded or expressed sentence, phrase, or only a word on its own, which asks for information, a reply, or a response; an interrogative.",803565757
fact,Something actual as opposed to invented.,781236138
another,"One more further, in addition to the quantity by then; a second or additional one, similar in likeness or in effect.",776983608
come,To move nearer to the point of perspective.,773538823
little,Small in size.,771505183
rate,The worth of something; value.,769819795
back,At or near the rear.,768418978
national,"Pertaining to a nation or country, especially as a whole; affecting, shared by, or existing throughout all of a nation.",766508663
every,"of a countable group (considered individually), without exception.",758645868
information,"That which resolves uncertainty; anything that answers the question of ""what a given entity is"".",752110130
program,A set of structured activities; a plan of action.,751633791
give,"To move, shift, provide something abstract or concrete to someone or something or somewhere.",747790302
interest,"The price paid for obtaining, or price received for providing, money or goods in a credit transaction, calculated as a fraction of the amount or value of what was borrowed.",745181440
development,"The process of developing; growth, directed change.",742485589
problem,A difficulty that has to be resolved or dealt with.,740224391
woman,An adult female human.,736965353
thing,"That which is considered to exist as a separate entity, object, quality or concept.",732822187
cost,To incur a charge of; to require payment of a (specified) price.,732666848
second,Number-two; following after the first one with nothing between them.,732268255
term,"That which limits the extent of anything; limit, extremity, bound, boundary, .",729410656
might,", strength, force or influence held by a person or group.",726220992
condition,A state or quality.,723504217
university,"Institution of higher education (typically accepting students from the age of about 17 or 18, depending on country, but in some exceptional cases able to take younger students) where subjects are studied and researched in depth and degrees are offered.",722862880
small,Not large or big; insignificant; few in number.,721087866
