lemma,definition,len_tokens,mean_log_freq,median_log_freq,miss_rate
mulberry,any of several trees of the genus Morus having edible fruit that resembles the blackberry,8,-5.069216535304831,-5.1702656708672095,0.25
zipping,close with a zipper,2,-4.538235659050011,-4.538235659050011,0.0
anecdote,short account of an incident (especially a biographical one),5,-4.237562332392133,-4.185166023260534,0.19999999999999996
montez,Irish dancer (1818-1861),2,-4.809373589837461,-4.809373589837461,0.0
composure,steadiness of mind under stress,3,-4.029384851895086,-4.029384851895086,0.33333333333333337
remiss,failing in what duty requires,3,-4.529549138448377,-4.54799268105628,0.0
leakage,the discharge of a fluid from some container,3,-5.123934499599475,-5.115260777136682,0.0
flemish,an ethnic group speaking Flemish and living in northern and western Belgium,8,-4.8401732934740265,-4.867582274377756,0.0
muddle,a confused multitude of things,3,-4.457876559194317,-4.532924880361838,0.0
decreasing,becoming less or smaller,3,-3.8482565532792474,-3.837843652381665,0.0
loom,"come into view indistinctly, often threateningly",5,-3.938207429426111,-4.254729585369727,0.19999999999999996
morsel,a small quantity of anything,3,-4.108749188448362,-3.837843652381665,0.0
flamenco,guitar music composed for dancing the flamenco,5,-4.852113056771254,-4.7019620997791955,0.0
lifelike,evoking lifelike images within the mind,4,-4.660903676906335,-4.40882565380429,0.25
specializing,become more focus on an area of activity or field of study,6,-4.176699805451848,-4.127263814584767,0.0
derailed,cause to run off the tracks,3,-3.841993360314517,-4.019191457228289,0.0
groundwork,the fundamental assumptions from which something is begun or developed or calculated or explained,7,-4.5756347190723625,-5.003266036553708,0.0
recalling,recall knowledge from memory; have a recollection,4,-4.765570127810421,-4.599798489478781,0.0
glistening,reflecting light,2,-4.474122604272022,-4.474122604272022,0.0
manifested,"provide evidence for; stand as proof of; show by one's behavior, attitude, or external attributes",9,-4.493318289978691,-4.642499589442912,0.0
worshiped,love unquestioningly and uncritically or to excess; venerate as an idol,6,-4.527473785710355,-5.171149280464811,0.5
knighthood,aristocrats holding the rank of knight,4,-4.632520069688986,-4.716993239781273,0.0
poltergeist,a ghost that announces its presence with rapping and the creation of disorder,6,-4.975636934619522,-4.969883040132821,0.0
mvp,the player judged to be the most important to the sport,4,-4.129882267736055,-4.205420127886068,0.0
shiner,a swollen bruise caused by a blow to the eye,5,-4.381375598492208,-4.019191457228289,0.0
disarray,a mental state characterized by a lack of clear and orderly thought and behavior,8,-4.446310748119625,-4.642466539032842,0.0
innermost,being deepest within the self,2,-4.718106939606679,-4.718106939606679,0.0
centimetre,a metric unit of length equal to one hundredth of a meter,6,-4.907293960266665,-4.696725356112212,0.16666666666666663
crumpled,of metal e.g.,1,-4.50717171330391,-4.50717171330391,0.0
undisputed,generally agreed upon; not subject to dispute,4,-4.724865085278842,-4.732843651908392,0.0
blabbing,divulge confidential information or secrets,4,-4.717377875014609,-4.5737788975243285,0.0
escalade,an act of scaling by the use of ladders (especially the walls of a fortification),7,-4.196991204839292,-4.051064449420423,0.1428571428571429
poon,wood of any poon tree; used for masts and spars,6,-4.939575543975564,-4.961102063565062,0.0
stopwatch,a timepiece that can be started or stopped for exact timing (as of a race),6,-3.998355863968252,-4.1880814237947845,0.16666666666666663
yosemite,a series of waterfalls in Yosemite National Park in California; is reduced to a trickle for part of each year,9,-4.452289208878931,-4.449628842721999,0.11111111111111116
columnist,a journalist who writes editorials,3,-4.850627728454203,-4.8848019219507375,0.0
huron,the 2nd largest of the Great Lakes,3,-3.947809690332567,-4.317326232567054,0.0
debauchery,a wild gathering involving excessive drinking and promiscuity,6,-4.75093512456249,-4.654599659951523,0.16666666666666663
postponing,hold back to a later time,4,-3.0741882056190994,-3.0297346660109445,0.0
gillette,United States inventor and manufacturer who developed the safety razor (1855-1932),7,-4.818575290109143,-5.003266036553708,0.0
alienated,socially disoriented,2,-5.612050167647047,-5.612050167647047,0.5
clawing,"move as if by clawing, seizing, or digging",4,-4.553789334958997,-4.8722461851422345,0.0
mailer,United States writer (born in 1923),4,-4.1849583339977245,-4.208559203556808,0.0
pennant,the award given to the champion,3,-4.099546866058518,-4.6346410170569685,0.0
deteriorated,become worse or disintegrate,3,-4.382721158508902,-3.808478267411871,0.0
loneliest,lacking companions or companionship,3,-5.163578173960622,-4.984370697583385,0.0
yodel,a songlike cry in which the voice fluctuates rapidly between the normal voice and falsetto,8,-4.135388838254772,-3.820372136196282,0.375
journalistic,of or relating to or having the characteristics of journalism,3,-5.459408614479231,-5.475869840221214,0.0
pulley,a simple machine consisting of a wheel with a groove in which a rope can run to change the direction or point of application of a force applied to the rope,14,-4.408579502630927,-4.409570373139973,0.0
freebie,something that is free (usually provided as part of a promotional scheme),7,-4.300199329457446,-4.212411506086151,0.0
hairbrush,a brush used to groom a person's hair,5,-4.160788440149309,-3.8526691334053726,0.0
harmonic,of or relating to harmony as distinct from melody and rhythm; - Ralph Hill,7,-5.038073660621429,-5.1266446070880125,0.0
unprovoked,occurring without motivation or provocation; ; - F.D.Roosevelt,3,-5.490114650269173,-5.449174908690624,0.0
duma,a legislative body in the ruling assembly of Russia and of some other republics in the former USSR,8,-4.915786520424909,-4.85308745129075,0.0
welder,joins pieces of metal by welding them together,5,-4.341590669590016,-4.0417636141504385,0.0
churn,stir (cream) vigorously in order to make butter,6,-4.470031722799533,-4.517437450956464,0.0
overbearing,expecting unquestioning obedience,3,-4.825474468768691,-4.825474468768691,0.33333333333333337
ingest,"serve oneself to, or consume regularly",3,-5.086244847032719,-5.370200160086087,0.0
unzips,open the zipper of,2,-4.468694248528544,-4.468694248528544,0.0
montmartre,the highest point in Paris; famous for its associations with many artists,7,-4.086906635963478,-4.236084222092864,0.0
tchaikovsky,important Russian composer whose works are noted for their expressive melodies (1840-1893),7,-4.583594849329637,-4.226606372549595,0.0
strider,a person who walks rapidly with long steps,5,-3.8820043863057743,-3.653885784023929,0.0
salina,a town in central Kansas,3,-4.444640042230797,-4.542213109298255,0.0
socializing,the act of meeting for social purposes,4,-4.040286387740103,-4.126450306628002,0.0
tarantula,large southern European spider once thought to be the cause of tarantism (uncontrollable bodily movement),10,-4.623454477238506,-4.66384149021301,0.09999999999999998
moro,a member of the predominantly Muslim people in the southern Philippines,6,-4.516904255078229,-4.867546786796891,0.16666666666666663
archimedes,Greek mathematician and physicist noted for his work in hydrostatics and mechanics and geometry (287-212 BC),9,-4.963677427897736,-5.2407800581101105,0.11111111111111116
tucking,fit snugly into,2,-4.145827953286044,-4.145827953286044,0.5
administering,work in an administrative capacity; supervise or be in charge of,5,-4.68627272263494,-5.057433516125037,0.0
indescribable,defying expression or description,3,-5.062060645525929,-4.87547246358481,0.0
traitorous,"having the character of, or characteristic of, a traitor",3,-4.805736215808403,-4.631030155052115,0.0
inhumane,lacking and reflecting lack of pity or compassion,5,-4.858720159574348,-4.6318431294313465,0.0
skinhead,a young person who belongs to a British or American group that shave their heads and gather at rock concerts or engage in white supremacist demonstrations,14,-4.225727687838257,-4.023497426962489,0.0714285714285714
masking,the act of concealing the existence of something by obstructing the view of it,6,-4.608962953307831,-4.562732398660183,0.0
fantasia,a musical composition of a free form usually incorporating several familiar themes,9,-4.6775831596094655,-4.468629019286168,0.0
annulled,declare invalid,2,-5.388347434330544,-5.388347434330544,0.0
fatherly,like or befitting a father or fatherhood; kind and protective,5,-3.873897669956833,-3.2499108912534185,0.4
kazan,United States stage and screen director (born in Turkey) and believer in method acting (1909-2003),10,-4.3940799885260375,-4.29379058832925,0.0
aimlessly,without aim; in an aimless manner,3,-4.671065100528956,-4.671065100528956,0.33333333333333337
disposing,"give, sell, or transfer to another",3,-3.8455869322644056,-3.9863767612565284,0.0
nantucket,an island resort off Cape Cod; formerly a center of the whaling industry,8,-4.924501635612609,-4.9572166103763315,0.0
obeys,be obedient to,1,-5.678190773732306,-5.678190773732306,0.0
creeper,any plant (as ivy or periwinkle) that grows by creeping,5,-4.641043304725132,-4.602842505325138,0.19999999999999996
coates,put a coat on; cover the surface of; furnish with a surface,6,-4.463529968021423,-4.493067534130567,0.0
overdone,represented as greater than is true or reasonable,4,-4.070260075021212,-4.16512815047802,0.0
undermined,destroy property or hinder normal operations,5,-4.592077532271722,-4.220610249210652,0.0
geometric,characterized by simple geometric forms in design and decoration,6,-5.11771798303512,-5.000463116548732,0.0
arroyo,a stream or brook,2,-5.043924542835071,-5.043924542835071,0.0
collectively,in conjunction with; combined,2,-5.714097238324285,-5.714097238324285,0.0
amok,frenzied as if possessed by a demon,3,-4.765107388074549,-4.765107388074549,0.33333333333333337
adoring,love intensely,2,-4.402193806787947,-4.402193806787947,0.0
methodology,the branch of philosophy that analyzes the principles and procedures of inquiry in a particular discipline,8,-4.92998341464033,-4.918592072067618,0.0
krakow,an industrial city in southern Poland on the Vistula,5,-4.737697578140687,-5.015427019163297,0.19999999999999996
delphi,an ancient Greek city on the slopes of Mount Parnassus; site of the oracle of Delphi,9,-4.902161827106351,-4.785514594728645,0.11111111111111116
stickup,robbery at gunpoint,2,-5.2201860452446915,-5.2201860452446915,0.0
councilwoman,a woman who is a council member,3,-3.9751222122026513,-4.16375391096713,0.0
ritalin,central nervous system stimulant (trade name Ritalin) used in the treatment of narcolepsy in adults and attention deficit disorder in children,15,-4.4148093417799075,-4.410853350076009,0.1333333333333333
doj,the United States federal department responsible for enforcing federal laws (including the enforcement of all civil rights legislation); created in 1870,14,-4.471476392575956,-4.493701315573011,0.0
aries,(astrology) a person who is born while the sun is in Aries,5,-4.8092935469703635,-4.093576924335834,0.0
kama,Hindu god of love and erotic desire; opposite of Mara,7,-4.504763889991312,-4.692672851990801,0.0
takeaway,prepared food that is intended to be eaten off of the premises,5,-4.529521811620204,-4.650109325216993,0.0
almanac,an annual publication including weather forecasts and other miscellaneous information arranged according to the calendar of a given year,12,-4.674428301015187,-4.973545881255013,0.08333333333333337
tweaking,pinch or squeeze sharply,3,-5.071020571964053,-5.113126923566342,0.0
audacious,invulnerable to fear or intimidation,3,-5.356351606532502,-5.921321428006515,0.0
riverbank,the bank of a river,2,-4.070782495184725,-4.070782495184725,0.0
amino,the radical -NH2,1,-5.163961669720091,-5.163961669720091,0.0
cr,a hard brittle multivalent metallic element; resistant to corrosion and tarnishing,8,-5.051470462374028,-5.458007822249388,0.375
thirteenth,coming next after the twelfth in position,4,-3.9679588967005923,-3.6918318612668957,0.0
braille,French educator who lost his sight at the age of three and who invented a system of writing and printing for sightless people (1809-1852),11,-4.015223993792934,-3.9645005579564523,0.18181818181818177
womanhood,the state of being an adult woman,3,-3.8431769524913304,-3.773182638988441,0.0
benevolence,disposition to do good,2,-4.106925895092618,-4.106925895092618,0.0
stonewall,obstruct or hinder any discussion,3,-5.739349121466048,-6.099398160492871,0.0
transpired,"pass through the tissue or substance or its pores or interstices, as of gas",6,-5.057570436979502,-4.972281775336963,0.33333333333333337
grieved,feel grief,2,-4.008466125207799,-4.008466125207799,0.0
monotonous,tediously repetitious or lacking in variety,4,-4.892848327535756,-4.892848327535756,0.5
braying,braying characteristic of donkeys,3,-5.506224447029244,-5.475869840221214,0.0
doer,a person who acts and gets things done,5,-2.914855355640107,-2.7763275074980056,0.0
snuffed,sniff or smell inquiringly,3,-4.405998408948321,-4.405998408948321,0.33333333333333337
forego,be earlier in time; go back further,4,-2.926216781129064,-2.6693679561081685,0.0
incinerate,become reduced to ashes,3,-4.555423037695163,-4.62978408840256,0.0
jargon,a characteristic language of a particular group (as among thieves),5,-4.526446827477122,-4.3521279327239695,0.0
deplorable,bad; unfortunate,2,-4.027489694554244,-4.027489694554244,0.0
bequeath,leave or give by will after one's death,3,-3.2284480869195242,-3.197201479377874,0.0
pizzeria,a shop where pizzas are made and sold,4,-3.870496008236962,-4.078989140190339,0.0
pivotal,being of crucial importance; ; - Henry Kissinger,4,-5.142354889961234,-5.1252805358903455,0.0
telecom,(often plural) systems used in transmitting messages over a distance electronically,8,-4.6724771021169715,-4.266320458494752,0.0
sinkhole,a depression in the ground communicating with a subterranean passage (especially in limestone) and formed by solution or by collapse of a cavern roof,12,-5.003396167641606,-5.00517171893382,0.0
quasi,having some resemblance,1,-5.508915641203889,-5.508915641203889,0.0
ptolemy,Alexandrian astronomer (of the 2nd century) who proposed a geocentric system of astronomy that was undisputed until the late Renaissance,10,-5.0058256724921515,-5.249361598716305,0.19999999999999996
deathly,having the physical appearance of death,3,-4.312613828597354,-4.56207488664002,0.0
aqueduct,a conduit that resembles a bridge but carries water over a valley,6,-4.661829393808145,-4.43489508181788,0.0
shortened,cut short,2,-3.815139756804416,-3.815139756804416,0.0
insulated,"protect from heat, cold, or noise by surrounding with insulating material",7,-4.400429231348856,-4.360499663177902,0.1428571428571429
kc,one thousand periods per second,3,-3.9777709294809704,-3.981525718123886,0.0
jeopardized,pose a threat to; present a danger to,4,-4.4204783393526945,-4.301379229916928,0.0
illustration,artwork that helps make something clear or attractive,6,-3.8050569023598233,-3.3288570938547215,0.0
sixteenth,coming next after the fifteenth in position,4,-4.025370046313564,-3.6918318612668957,0.0
routinely,according to routine or established practice,4,-4.961285065478442,-4.909566770383536,0.0
aground,stuck in a place where a ship can no longer float,5,-4.011760824012332,-3.9083918973760405,0.0
distilled,undergo condensation; change from a gaseous to a liquid state and fall in drops,8,-4.3041954229020725,-3.841140190165365,0.25
gratification,state of being gratified or satisfied,3,-4.298306308312793,-4.298306308312793,0.33333333333333337
sparking,put in motion or move to act,4,-3.759165948104286,-3.622790388289776,0.0
smithereens,a collection of small fragments considered as a whole,5,-4.298969014728888,-4.282660813030657,0.0
ironclad,a wooden warship of the 19th century that is plated with iron or steel armor,7,-4.896208161545132,-4.868793011874145,0.1428571428571429
hoy,a flatbottom boat for carrying heavy loads (especially on canals),7,-4.356169067562033,-4.220358401600656,0.1428571428571429
notwithstanding,despite anything to the contrary (usually following a concession),5,-4.352575637389402,-4.212411506086151,0.0
onlooker,someone who looks on,2,-2.960471930191675,-2.960471930191675,0.0
skateboarding,the sport of skating on a skateboard,3,-5.157419860958764,-5.221660444866796,0.0
arisen,come into existence; take on form or shape,5,-3.7223678893831,-4.16447708852673,0.0
ethiopian,a native or inhabitant of Ethiopia,3,-5.458126040011298,-5.610709315890334,0.0
mercilessly,without pity; in a merciless manner,3,-5.001032889879805,-4.610142464345242,0.0
dived,drop steeply,2,-3.8505500449231147,-3.8505500449231147,0.5
expressive,characterized by expression,2,-5.563364850862124,-5.563364850862124,0.0
freudian,of or relating to Sigmund Freud or his psychoanalytic ideas,5,-5.104285259760619,-5.446877617959177,0.19999999999999996
bosun,a petty officer on a merchant ship who controls the work of other seamen,7,-4.31093344189229,-3.835223243114641,0.0
besieged,surround so as to force to give up,3,-4.046447347863231,-3.9104229585900385,0.0
easing,a change for the better,2,-3.044623151788274,-3.044623151788274,0.0
pressurized,increase the pressure on a gas or liquid,4,-4.551039997147258,-4.515014130209691,0.0
gamer,disabled in the feet or legs,3,-4.318529903531346,-3.9447382180411834,0.0
mediator,a negotiator who acts as a link between parties,4,-4.494023927098349,-4.287622042404532,0.0
gauri,"in Hinduism, goddess of purity and posterity and a benevolent aspect of Devi; the `brilliant'",8,-5.405822684388434,-5.497256766931331,0.125
sullen,showing a brooding ill humor; ; ; ; ; ; - Bruce Bliven,6,-4.635375166061688,-4.611700441513203,0.16666666666666663
optimum,most desirable possible under a restriction expressed or implied,5,-5.147018438569271,-5.635427219001169,0.0
newspaperman,a journalist employed to provide news stories for newspapers or broadcast media,8,-4.527600445718852,-4.583503638032816,0.0
insubordinate,not submissive to authority,2,-5.225167497514995,-5.225167497514995,0.0
panicky,thrown into a state of intense fear or desperation,5,-4.580519714766095,-4.683053449458537,0.0
redacted,formulate in a particular style or language,4,-4.399782036513444,-4.41860717206239,0.25
preying,profit from in an exploitatory manner,3,-4.66216224485858,-4.66216224485858,0.33333333333333337
scribble,write down quickly without much attention to detail,5,-3.860856907785763,-4.033222735515255,0.0
potomac,"a river in the east central United States; rises in West Virginia in the Appalachian Mountains and flows eastward, forming the boundary between Maryland and Virginia, to the Chesapeake Bay",18,-4.687892851874695,-4.5661763147645935,0.11111111111111116
underfoot,under the feet,1,-3.7285298848459627,-3.7285298848459627,0.0
plowed,to break and turn over earth especially with a plow,5,-4.162365912025717,-3.8294460002618647,0.0
toured,make a tour of a certain place,4,-3.6347196555452506,-3.631059216253977,0.0
linebacker,a defensive football player who takes a position close behind the linemen,7,-4.0547268893140656,-4.181029255956594,0.1428571428571429
misconception,an incorrect conception,2,-5.694124923227051,-5.694124923227051,0.0
tartarus,a place where the wicked are punished after death,4,-4.125972441621335,-4.21196973166632,0.0
fifteenth,coming next after the fourteenth and just before the sixteenth in position,5,-4.0249206205439725,-3.6918318612668957,0.19999999999999996
riveting,direct one's attention on something,3,-3.8180065807442083,-4.033222735515255,0.0
greenwood,woodlands in full leaf,3,-4.65780639070347,-4.260001962680723,0.0
motown,the largest city in Michigan and a major Great Lakes port; center of the United States automobile industry; located in southeastern Michigan on the Detroit river across from Windsor,17,-4.501373875638511,-4.366326512606584,0.05882352941176472
limber,a two-wheeled horse-drawn vehicle used to pull a field gun or caisson,8,-3.857965891426467,-3.8285386451370984,0.375
gantry,a framework of steel bars raised on side supports to bridge over or around something; can display railway signals above several tracks or can support a traveling crane etc.,17,-4.444097834315535,-4.276889208961083,0.0
ensured,make certain of,2,-3.440427719947164,-3.440427719947164,0.0
incarnation,a new personification of a familiar idea,4,-3.675081741025091,-3.400801933955046,0.25
likable,(of characters in literature or drama) evoking empathic or sympathetic feelings,7,-4.670933821376627,-4.761065168520243,0.2857142857142857
kohl,a cosmetic preparation used by women in Egypt and Arabia to darken the edges of their eyelids,9,-4.920806891533024,-5.113934308515681,0.0
marquee,large and often sumptuous tent,4,-4.440499768577857,-4.317326232567054,0.25
percussion,the act of playing a percussion instrument,4,-4.621577272377032,-4.39961100542964,0.0
sketching,make a sketch of,2,-3.931621213824525,-3.931621213824525,0.0
snub,refuse to acknowledge,2,-4.845988737720358,-4.845988737720358,0.0
crucible,a vessel made of material that does not melt easily; used for high temperature chemical reactions,10,-4.282123850921448,-4.6051673415418914,0.0
discontinued,put an end to a state or an activity,4,-3.72168349709212,-3.6042396540420363,0.0
defile,a narrow pass (especially one between mountains),4,-4.43002849982668,-4.1731552690904765,0.25
offed,kill intentionally and with premeditation,3,-4.395205288099721,-4.395205288099721,0.33333333333333337
applejack,distilled from hard cider,3,-4.617418709915268,-4.617418709915268,0.33333333333333337
jakarta,capital and largest city of Indonesia; located on the island of Java; founded by the Dutch in 17th century,10,-4.762124038806766,-4.724561429083225,0.09999999999999998
durable,existing for a long time,3,-3.4061290557666664,-3.1557252842055714,0.0
collaborating,work together on a common enterprise of project,5,-3.969008247927679,-4.300995914195702,0.0
nissan,the seventh month of the civil year; the first month of the ecclesiastic year (in March and April),10,-3.9072030232144623,-3.56386233071746,0.09999999999999998
biohazard,hazard to humans or the environment resulting from biological agents or conditions,7,-4.487370563594557,-4.276233056527436,0.0
blasphemous,grossly irreverent toward what is held to be sacred,4,-5.0823216791605095,-4.758413632188368,0.25
aught,a quantity of no importance,2,-5.240208057342878,-5.240208057342878,0.0
serotonin,a neurotransmitter involved in e.g. sleep and depression and memory,5,-4.2316641353493525,-4.0947073102325735,0.19999999999999996
refute,"overthrow by argument, evidence, or proof",4,-4.689547135581334,-4.527300233323392,0.0
irrefutable,impossible to deny or disprove,3,-4.410049426400896,-4.410049426400896,0.33333333333333337
sorrowful,experiencing or marked by or expressing sorrow especially that associated with irreparable loss; ; ; ; - Proverbs 14:13,9,-4.811195194348904,-4.730769035805212,0.0
gerbil,small Old World burrowing desert rodent with long soft pale fur and hind legs adapted for leaping,14,-4.4833531142386,-4.525820129845137,0.0714285714285714
punt,kick the ball,2,-4.006051184334195,-4.006051184334195,0.0
pecs,either of two large muscles of the chest,3,-4.470206065238476,-4.437521392326151,0.0
floored,surprise greatly; knock someone's socks off,5,-4.289382185505512,-4.119877549089236,0.0
conveyed,"make known; pass on, of information",4,-3.5522962496816657,-3.874024918584796,0.25
occipital,of or relating to the occiput,2,-5.356094957504237,-5.356094957504237,0.5
softened,toned down,1,-4.639989843326561,-4.639989843326561,0.0
gyro,a Greek sandwich: sliced roast lamb with onion and tomato stuffed into pita bread,10,-4.839625925492429,-4.906925652399102,0.0
placebo,an innocuous or inert medication; given as a pacifier or to the control group in experiments on the efficacy of a drug,10,-4.333152276548384,-4.023497426962489,0.30000000000000004
chandi,malevolent aspect of Devi,3,-5.530301179259238,-5.530301179259238,0.33333333333333337
waived,do without or cease to hold or adhere to,3,-4.8136475487730515,-4.956999935668271,0.0
unopened,not yet opened or unsealed,3,-3.436357873991055,-3.436357873991055,0.33333333333333337
sidearm,(of pitches) made with the arm moving parallel to the ground,6,-4.018408087995659,-3.9371744499391026,0.0
knifed,use a knife on,2,-3.836522523690022,-3.836522523690022,0.0
synchronize,make synchronous and adjust in time or manner,5,-3.8169899631052706,-3.7045288339606763,0.19999999999999996
thawed,become or cause to become soft or liquid,5,-4.202644519602364,-4.019191457228289,0.0
lurks,"lie in wait, lie in ambush, behave in a sneaky and secretive manner",8,-4.521012981242223,-4.678205583604726,0.0
gentler,soft and mild; not harsh or stern or severe,5,-4.996379047527594,-5.035657544514736,0.0
traceable,(usually followed by `to') able to be traced to,4,-4.063561372474981,-4.029054248697315,0.0
competed,compete for something; engage in a contest; measure oneself against others,6,-4.387601729974771,-4.759456175500073,0.0
gearing,wheelwork consisting of a connected set of rotating gears by which force is transmitted or motion or torque is changed,11,-4.866431223932666,-4.781189801498016,0.09090909090909094
underprivileged,lacking the rights and advantages of other members of society,5,-4.037408459406089,-4.438956647250982,0.0
duckling,flesh of a young domestic duck,4,-4.450571708864747,-4.562956498827612,0.0
auctioned,sell at an auction,2,-4.5444944531214935,-4.5444944531214935,0.0
enrich,make better or improve in quality,4,-3.7452120578133083,-3.706774668142897,0.0
sucre,the basic unit of money in Ecuador; equal to 100 centavos,6,-4.5738944947111,-4.667447837555009,0.16666666666666663
