lemma,definition,len_tokens,mean_log_freq,median_log_freq,miss_rate
electronically,by electronic means,2,-3.8931458480484293,-3.8931458480484293,0.0
warring,make or wage war,3,-3.8234343747939015,-3.644801695391476,0.0
dominick,American breed of chicken having barred grey plumage raised for meat and brown eggs,10,-4.3457987421279505,-4.250691254535671,0.09999999999999998
sweatpants,loose-fitting trousers with elastic cuffs; worn by athletes,6,-5.043396965687535,-5.133776001338332,0.16666666666666663
rancid,(used of decomposing oils or fats) having a rank smell or taste usually due to a chemical change or decomposition,12,-4.350784957496834,-4.212411506086151,0.08333333333333337
entrapment,a defense that claims the defendant would not have broken the law if not tricked into doing it by law enforcement officials,9,-4.272855381901068,-4.3625149656060485,0.0
discrepancy,a difference between conflicting facts or claims or opinions,5,-4.29654174579649,-4.355904854387938,0.0
mott,United States feminist and suffragist (1793-1880),4,-4.620508612009384,-4.323541482777782,0.25
forcefully,with full force,2,-3.813854751366555,-3.813854751366555,0.0
signify,denote or connote,2,,,1.0
ranging,wandering freely,2,-5.194719095932633,-5.194719095932633,0.0
swindled,deprive of by deceit,2,-5.78483853900416,-5.78483853900416,0.0
recognizable,easily perceived; easy to become aware of,5,-4.388486351317328,-4.3738216825372405,0.0
selecting,"pick out, select, or choose from a number of alternatives",5,-4.350793254001621,-4.203704471002909,0.0
servitude,state of subjection to an owner or master or forced labor imposed as punishment,8,-4.448569256096535,-4.43495640771657,0.125
bering,Danish explorer who explored the northern Pacific Ocean for the Russians and discovered the Bering Strait (1681-1741),10,-5.140085376023175,-5.062921735892271,0.0
liquidate,get rid of (someone who may be a threat) by killing,5,-3.4954660819585563,-3.264934231080262,0.0
warns,"notify of danger, potential harm, or risk",5,-4.542524549398832,-4.43765382441619,0.0
miser,a stingy hoarder of money and possessions (often living miserably),7,-4.572852704194535,-4.467403831078604,0.1428571428571429
brained,hit on the head,2,-3.4544519372053,-3.4544519372053,0.0
contradictory,of words or propositions so related that both cannot be true and both cannot be false,5,-4.301097882056671,-4.598533092651958,0.0
sociology,the study and classification of human societies,4,-4.648395018760742,-4.330555370959151,0.0
decimated,"kill one in every ten, as of mutineers in Roman armies",5,-3.9096099551194565,-3.9036781430019367,0.19999999999999996
carthage,an ancient city state on the north African coast near modern Tunis; founded by Phoenicians; destroyed and rebuilt by Romans; razed by Arabs in 697,15,-4.470833689460914,-4.57548403148114,0.2666666666666667
diddly,a small worthless amount,3,-4.427183011374589,-4.44445717146412,0.0
choreographer,someone who creates new dances,4,-3.681025324009588,-3.571419801584712,0.0
bosnian,of or relating to or characteristic of Bosnia-Herzegovina or the people of Bosnia,5,-4.901706755468082,-5.415982398862726,0.19999999999999996
credited,give someone credit for something,4,-3.339850652004918,-3.0947568926256053,0.0
yoghurt,a custard-like food made from curdled milk,5,-3.646202919191643,-3.76883072468368,0.4
congenital,present at birth but not necessarily hereditary; acquired during fetal development,7,-5.078375065357465,-4.959352353527366,0.0
jenner,English physician who pioneered vaccination; Jenner inoculated people with small amounts of cowpox to prevent them from getting smallpox (1749-1823),13,-4.504044436219937,-4.62953827152745,0.23076923076923073
revel,take delight in,2,-3.9552003652090257,-3.9552003652090257,0.0
impregnable,immune to attack; incapable of being tampered with,4,-5.164325445792863,-5.317471791816127,0.0
rockies,the chief mountain range of western North America; extends from British Columbia to northern New Mexico; forms the continental divide,15,-4.5511129652654985,-4.522305121761295,0.0
willies,feelings of uneasiness,2,-3.6598097669641687,-3.6598097669641687,0.5
overdosed,dose too heavily,2,-4.880919392218537,-4.880919392218537,0.0
reassurance,the act of reassuring; restoring someone's confidence,5,-4.547033684279437,-4.676732270920503,0.0
unguarded,lacking protection or a guard,3,-4.391746876334019,-4.5240273262739725,0.0
stupendous,so great in size or force or extent as to elicit awe,6,-4.425241515804336,-4.315583498461688,0.16666666666666663
horowitz,Russian concert pianist who was a leading international virtuoso (1904-1989),6,-4.64761192259323,-4.652166478853422,0.16666666666666663
i.e.,that is to say; in other words,2,-3.080931142986562,-3.080931142986562,0.0
weepy,liable to weep easily,3,-5.0642941696148025,-5.27205667105873,0.0
homely,lacking in physical beauty or proportion,4,-4.7302944677064165,-4.596959008035683,0.0
cutback,a reduction in quantity or rate,3,-5.208934955785852,-5.431144103539091,0.0
unsuitable,not meant or adapted for a particular purpose,4,-4.565569967502408,-4.427396270430068,0.0
revolve,turn on or around an axis or a center,4,-4.1490380801295945,-3.8750936675707903,0.0
caprice,a sudden desire,2,-4.488673757912773,-4.488673757912773,0.0
batty,informal or slang terms for mentally irregular,5,-5.365602476692554,-5.629721510742459,0.0
gazebo,a small roofed building affording shade and rest,6,-4.251958736549422,-4.313196991134032,0.0
browsing,reading superficially or at random,3,-4.237378645335526,-4.237378645335526,0.33333333333333337
rewriting,editing that involves writing something again,4,-4.4301024601007475,-4.607326256833408,0.0
roomie,an associate who shares a room with you,3,-4.074270580056299,-4.065816639239502,0.0
ferrara,a city in northern Italy,3,-4.467077565021742,-4.794117728205016,0.0
lapping,covering with a design in which one element covers a part of another (as with tiles or shingles),7,-4.371754234613633,-4.298861464915207,0.1428571428571429
riffraff,disparaging terms for the common people,4,-3.8334839942678784,-4.278896454562161,0.25
basque,a member of a people of unknown origin living in the western Pyrenees in France and Spain,9,-4.29014038440301,-4.560561204685126,0.11111111111111116
carelessness,the quality of not being careful or taking pains,4,-4.0189092671593505,-3.926027035604375,0.0
whiter,being of the achromatic color of maximum lightness; having little or no hue owing to reflection of almost all incident light,11,-4.387555467544857,-4.287973604664366,0.18181818181818177
foothold,an area in hostile territory that has been captured and is held awaiting further troops and supplies,8,-4.53125801385378,-4.638694939654755,0.0
recommends,push for something,2,-3.485689776348756,-3.485689776348756,0.0
unpleasantness,the feeling caused by disagreeable stimuli; one pole of a continuum of states of feeling,8,-4.395205325581261,-4.019191457228289,0.125
shredding,tear into shreds,2,-4.790523514589683,-4.790523514589683,0.0
copier,"apparatus that makes copies of typed, written or drawn material",7,-4.2400200741341,-4.158138171438313,0.0
distantly,from or at a distance,1,-4.353926457626539,-4.353926457626539,0.0
plunger,someone who risks losses for the possibility of considerable gains,6,-4.404263275356963,-4.483816183504819,0.0
discontent,a longing for something better than the present situation,5,-3.30737141380409,-3.1557252842055714,0.0
grossly,in a gross manner,2,-4.672518611873439,-4.672518611873439,0.0
tweaked,pinch or squeeze sharply,3,-5.071020571964053,-5.113126923566342,0.0
fastball,(baseball) a pitch thrown with maximum velocity,4,-4.98751206864259,-4.897233653022764,0.0
migrate,move from one country or region to another and settle there,4,-4.091914008877826,-4.06407871568329,0.0
abilene,a city in central Texas,3,-4.284373150638577,-4.542213109298255,0.0
koto,Japanese stringed instrument that resembles a zither; has a rectangular wooden sounding board and usually 13 silk strings that are plucked with the fingers,14,-4.670720535355245,-4.621752581071184,0.1428571428571429
westbound,moving toward the west,2,-3.7612477015754973,-3.7612477015754973,0.0
pongo,type genus of the family Pongidae: orangutans,5,-3.759184270976456,-3.759184270976456,0.6
bushy,used of hair; thick and poorly groomed,5,-4.517303728966347,-4.785834554842372,0.0
mosaic,art consisting of a design made of small pieces of colored stone or glass,9,-4.192986576480056,-4.081021550532144,0.0
blissful,completely happy and contented,3,-4.116204188304715,-4.028642632777496,0.0
sg,a transuranic element,2,-4.729980101157237,-4.729980101157237,0.5
kipling,English author of novels and poetry who was born in India (1865-1936),6,-4.5889619320189174,-4.706713004114944,0.0
tightened,make tight or tighter,3,-4.155939508924645,-4.268214577314524,0.0
psychedelic,producing distorted sensory perceptions and feelings or altered states of awareness or sometimes states resembling psychosis,11,-4.828521470109699,-5.23712187790794,0.0
dismembered,separate the limbs from the body,3,-4.416175773513449,-4.599761231993911,0.0
maitland,English historian noted for his works on the history of English law (1850-1906),7,-4.107609111975273,-4.0943315723825675,0.0
middleweight,an amateur boxer who weighs no more than 165 pounds,4,-4.9106829743943265,-5.0731266312625465,0.0
scranton,an industrial city of northeastern Pennsylvania,4,-4.711896095693586,-5.1633072515297025,0.25
astrologer,someone who predicts the future by the positions of the planets and sun and Moon,7,-4.111761594966569,-4.0390232479732004,0.0
vanderbilt,United States financier who accumulated great wealth from railroad and shipping businesses (1794-1877),9,-4.514648215703354,-4.637535302435078,0.11111111111111116
wallop,hit hard,2,-3.5110455315513627,-3.5110455315513627,0.0
squander,spend thoughtlessly; throw away,4,-3.6990068322648426,-3.914135285753546,0.25
buggered,practice anal sex upon,3,-4.586745598162113,-4.337825027024516,0.0
clawed,"move as if by clawing, seizing, or digging",4,-4.553789334958997,-4.8722461851422345,0.0
artiste,a public performer (a dancer or singer),4,-4.751986814475318,-4.729110116065518,0.0
humbug,pretentious or silly talk or writing,4,-4.2588527913710985,-4.106685015607271,0.0
sizzle,make a sound like frying fat,4,-3.7967600736571434,-3.840593914977603,0.0
foghorn,a loud low warning signal that can be heard by fogbound ships,7,-4.091376359651524,-4.208747077139228,0.1428571428571429
lymph,a thin coagulable fluid (similar to plasma but) containing white blood cells (lymphocytes) and chyle; is conveyed to the blood stream by lymphatic vessels,16,-4.5805244331068184,-4.726127613207548,0.25
temperamental,relating to or caused by temperament,3,-5.112717275389895,-5.356094957504237,0.0
hubris,overbearing pride or presumption,3,-5.372028275205569,-5.372028275205569,0.33333333333333337
teensy,(used informally) very small,3,-3.644863545613398,-3.644863545613398,0.33333333333333337
recapture,experience anew,2,-4.9939854490247635,-4.9939854490247635,0.0
kosovo,a Serbian province in southern Serbia and Montenegro populated predominantly by Albanians,8,-5.622193424489054,-5.80037240910579,0.25
catatonic,characterized by catatonia especially either rigidity or extreme laxness of limbs,7,-5.081844745244406,-4.948876539622233,0.4285714285714286
caligula,Roman Emperor who succeeded Tiberius and whose uncontrolled passions resulted in manifest insanity; noted for his cruelty and tyranny; was assassinated (12-41),13,-5.031215937405154,-5.08759639322254,0.07692307692307687
nostradamus,French astrologer who wrote cryptic predictions whose interpretations are still being debated (1503-1566),8,-4.913892186053576,-5.251864972586787,0.0
guam,the largest and southernmost island in the Marianas which is administered as a territory of the United States; it was ceded by Spain to the United States in 1898,12,-4.437172962196794,-4.323541482777782,0.25
woolly,having a fluffy character or appearance,3,-4.88794011658779,-4.812203371942291,0.0
grange,an outlying farm,2,-4.433421846390711,-4.433421846390711,0.5
presumption,an assumption that is taken for granted,3,-4.165645905752993,-4.496641317375724,0.0
reactive,participating readily in reactions,3,-5.314504729116925,-5.276440241363095,0.0
deterioration,a symptom of reduced quality or strength,4,-4.7567934320399035,-4.745416578005328,0.0
hairless,having no hair or fur,2,-4.442566454878625,-4.442566454878625,0.0
ravenous,extremely hungry,2,-4.348897688091453,-4.348897688091453,0.0
undertaken,enter upon an activity or enterprise,3,-4.611228221902206,-4.584378304751884,0.0
sunup,the first light of day,3,-3.2057951252954653,-3.0597047850075163,0.0
emporium,a large retail store organized into departments offering a variety of merchandise; commonly part of a retail chain,12,-4.7908644118980455,-4.813100927861948,0.0
argyle,a covered gravy holder of silver or other metal containing a detachable central vessel for hot water to keep the gravy warm,14,-4.483206427718656,-4.50717171330391,0.0714285714285714
tongs,any of various devices for taking hold of objects; usually have two hinged legs with handles above and pointed hooks below,11,-4.156552788896085,-4.212411506086151,0.0
genital,of or relating to the external sex organs,4,-4.876027636336554,-5.073697438828052,0.0
pyre,wood heaped for burning a dead body as a funeral rite,7,-4.320601289763994,-4.210576428542791,0.0
madder,Eurasian herb having small yellow flowers and red roots formerly an important source of the dye alizarin,12,-4.529445780679977,-4.445838159554812,0.16666666666666663
obsess,haunt like a ghost; pursue,3,-4.854930897922043,-5.1087129386249135,0.0
twine,"spin,wind, or twist together",4,-4.288204187910956,-4.440933768719083,0.0
honorably,in an honorable manner,2,-4.856322635168846,-4.856322635168846,0.0
responder,someone who responds,2,-4.534189683705511,-4.534189683705511,0.0
embroidery,elaboration of an interpretation by the use of decorative (sometimes fictitious) detail,7,-4.87921649324876,-4.916780191428437,0.1428571428571429
buckshot,small lead shot for shotgun shells,5,-4.192243320184078,-3.9119852946845057,0.0
hydrant,a faucet for drawing water from a pipe or cask,5,-4.590009109875428,-4.491471946393439,0.19999999999999996
barrie,Scottish dramatist and novelist; created Peter Pan (1860-1937),6,-4.8959284941077765,-4.781104225484326,0.16666666666666663
spiteful,showing malicious ill will and a desire to hurt; motivated by spite,7,-4.6561435912949545,-4.475505820820882,0.0
dishonored,bring shame or dishonor upon,3,-4.526940031883718,-4.299630527009613,0.0
veiled,having or as if having a veil or concealing cover,3,-4.939133113301005,-5.322751071599392,0.0
pate,liver or meat or fowl finely minced or ground and variously seasoned,8,-5.105636098508671,-4.820267666919144,0.125
jobless,not having a job,1,-3.357963763080888,-3.357963763080888,0.0
hounding,pursue or chase relentlessly,3,-5.2459261438450495,-5.1087129386249135,0.0
overseer,a person who directs and manages an organization,4,-4.275739848113763,-4.504426805208998,0.25
treading,"put down or press the foot, place the foot",5,-3.584976096695356,-3.7285298848459627,0.0
rudely,in an impolite manner,2,-5.269950648609003,-5.269950648609003,0.0
chatted,talk socially without exchanging too much information,5,-4.056446148085699,-3.98394862688409,0.0
rotary,relating to or characterized by rotation,3,-5.733640332843621,-5.586522316613455,0.0
molesting,harass or assault sexually; make indecent advances to,6,-4.801357983766857,-4.9229427085910835,0.0
realty,property consisting of houses and land,4,-4.428264384022302,-4.14510897205481,0.0
aquatic,a plant that lives in or on water,3,-3.783412609272526,-3.5705614322952908,0.0
molest,harass or assault sexually; make indecent advances to,6,-4.801357983766857,-4.9229427085910835,0.0
dartmouth,a college in New Hampshire,3,-4.3229027296494325,-4.1422910496206455,0.0
ringside,first row of seating; has an unobstructed view of a boxing or wrestling ring,8,-4.179938788364397,-4.02642011405127,0.125
steamy,filled with steam or emitting moisture in the form of vapor or mist,7,-5.244926257824979,-5.367817249389898,0.0
adulthood,the period of time in your life after your physical growth has stopped and you are fully developed,8,-4.062081990201586,-4.536482701662706,0.0
unbecoming,not in keeping with accepted standards of what is right or proper in polite society,7,-4.100169453753877,-4.507093997653561,0.0
dugout,either of two low shelters on either side of a baseball diamond where the players and coaches sit during the game,9,-4.166255541330329,-4.325298249934539,0.0
piloting,the guidance of ships or airplanes from place to place,5,-4.045368894713637,-3.798903085557727,0.0
misuse,apply to a wrong thing or person; apply badly or incorrectly,7,-4.310267358778332,-4.5530596864070265,0.0
shadowy,filled with shade,2,-4.6714035574198975,-4.6714035574198975,0.0
promotional,of or relating to serving as publicity,3,-4.943189440777596,-5.125767127575767,0.0
jettison,"throw away, of something encumbering",4,-3.290474384140545,-3.1179477940303193,0.25
businesswoman,a female businessperson,2,-4.352042474182053,-4.352042474182053,0.5
registrar,a person employed to keep a record of the owners of stocks and bonds issued by the company,9,-4.161229066843297,-4.205385968102939,0.0
voltaire,French writer who was the embodiment of 18th century Enlightenment (1694-1778),5,-4.981096174802568,-4.549532289888843,0.0
hairpin,a double pronged pin used to hold women's hair in place,8,-3.7023494613534074,-3.4518834388451305,0.125
coachman,a man who drives a coach (or carriage),4,-3.97702124522797,-4.064248753149743,0.0
garnish,something (such as parsley) added to a dish for flavor or decoration,6,-4.735130927067044,-4.836435764366348,0.0
brainstorm,the clear (and often sudden) understanding of a complex situation,6,-4.074194800002541,-4.092094817163373,0.0
kissinger,United States diplomat who served under President Nixon and President Ford (born in 1923),9,-4.4239357977619935,-4.323541482777782,0.0
redecorating,redo the decoration of an apartment or house,4,-4.644175993326731,-4.749836255569166,0.0
reinvent,bring back into existence,3,-3.647706718078947,-3.4595784418924205,0.0
shimmer,a weak and tremulous light,3,-4.0082125908872595,-4.0082125908872595,0.33333333333333337
clotting,the process of forming semisolid lumps in a liquid,5,-4.68828112174554,-4.694596790278986,0.19999999999999996
rejoicing,a feeling of great happiness,3,-3.5999040856437623,-3.1742334439138458,0.0
ode,a lyric poem with complex stanza forms,5,-4.747826634307083,-4.801546380266306,0.19999999999999996
terrify,fill with terror; frighten greatly,4,-4.937311748859178,-5.057714590179852,0.0
validity,the quality of being valid and rigorous,3,-5.322542392239542,-5.375620251651405,0.0
styling,designate by an identifying term,3,-4.514730485392818,-4.514730485392818,0.33333333333333337
abnormality,an abnormal physical condition resulting from defective genes or developmental deficiencies,8,-4.999893910386086,-4.728074019389699,0.125
varies,"become different in some particular way, without permanently losing one's or its former characteristics or essence",9,-4.352538525733012,-4.527620364946415,0.0
enact,order by virtue of superior authority; decree,5,-4.694596709045474,-4.7675179376395755,0.0
gritty,composed of or covered with particles resembling meal in texture or consistency,7,-5.300182047850157,-5.684491615495809,0.0
sedition,an illegal action inciting resistance to lawful authority and tending to cause the disruption or overthrow of the government,11,-4.936321120182646,-4.852067449287649,0.0
synaptic,(neuroscience) of or involving synapses,3,-5.129636713997313,-5.129636713997313,0.6666666666666667
stoker,Irish writer of the horror novel about Dracula (1847-1912),5,-4.891984067517685,-4.8652362653879075,0.0
enthusiast,an ardent and enthusiastic supporter of some person or activity,5,-5.073013538539469,-5.43109750541867,0.0
marauder,someone who attacks in search of booty,4,-4.1485393645334225,-4.053882055379004,0.0
bankroll,a roll of currency notes (often taken as the resources of a person or business etc.),9,-4.2103608937742765,-4.153687443913987,0.0
hammerhead,a stupid person; these words are used to express a low opinion of someone's intelligence,9,-3.915530686980698,-3.7419325067028195,0.0
entice,provoke someone to do something through (often false or exaggerated) promises or persuasion,8,-4.440584587792824,-4.388623776007462,0.0
codex,an official list of chemicals or medicines etc.,5,-4.615640535919004,-4.431020629449105,0.0
illuminating,tending to increase knowledge or dissipate ignorance,5,-4.883886931959175,-4.829856135553,0.19999999999999996
gecko,any of various small chiefly tropical and usually nocturnal insectivorous terrestrial lizards typically with immovable eyelids; completely harmless,14,-5.1129213642120535,-5.187297953519651,0.2142857142857143
flog,beat severely with a whip or rod,4,-4.763202993418867,-4.8818933459533795,0.0
mayflower,the ship in which the Pilgrim Fathers sailed from England to Massachusetts in 1620,6,-4.499783860067942,-4.57797831004352,0.0
inciting,give an incentive for action,3,-4.257284002278642,-4.115075052526635,0.0
nationalist,one who loves and defends his or her country,3,-3.7594065748278567,-3.7349608842263007,0.0
hideaway,a hiding place; usually a remote place used by outlaws,7,-4.029477631334085,-4.051802639615955,0.0
notable,worthy of notice,2,-4.528654760279013,-4.528654760279013,0.0
galore,in great numbers,2,-3.335820604675261,-3.335820604675261,0.0
presenter,someone who presents a message of some sort (as a petition or an address or a check or a memorial etc.),9,-4.295437798069381,-3.9983174752623096,0.0
poise,"be motionless, in suspension",2,-5.375251337015052,-5.375251337015052,0.5
plentiful,existing in great number or quantity,4,-4.128883227542062,-3.983407569499623,0.0
detainee,some held in custody,2,-4.008381727455326,-4.008381727455326,0.0
citrus,any of numerous fruits of the genus Citrus having thick rind and juicy pulp; grown in warm regions,11,-5.032102651105262,-4.919646264907458,0.18181818181818177
boosted,increase,1,-4.779521506510729,-4.779521506510729,0.0
lashed,beat severely with a whip or rod,4,-4.763202993418867,-4.8818933459533795,0.0
gaff,a sharp metal spike or spur that is fastened to the leg of a gamecock,6,-5.024467763301407,-4.919187263182925,0.16666666666666663
invariably,"without variation or change, in every case",3,-4.2093812630391785,-3.5512472416255276,0.0
strenuous,characterized by or performed with much energy or force,5,-4.43718665800724,-4.256446884649701,0.0
impervious,not admitting of passage or capable of being affected,4,-4.637593934718234,-4.674238266409056,0.0
sloshing,make a splashing sound,3,-3.964155600598508,-3.528927299122913,0.0
slacker,a person who shirks his work or duty (especially one who tries to evade military service in wartime),10,-4.258855460337845,-4.164585542973987,0.09999999999999998
shackled,bound by chains fastened around the ankles,4,-5.141491576066528,-5.252177282843222,0.0
advisable,worthy of being recommended or suggested; prudent or wise,5,-4.989152252603769,-4.869511490593059,0.0
conga,music composed for dancing the conga,4,-4.875129801026975,-4.8737691767471425,0.0
barkeep,an employee who mixes and serves alcoholic drinks at a bar,6,-4.388078855327453,-4.475700802153691,0.0
footman,a man employed as a servant in a large establishment (as a palace) to run errands and do chores,9,-4.450491758733966,-4.562645747946577,0.11111111111111116
dispensary,clinic where medicine and medical supplies are dispensed,5,-4.765960409208029,-4.443056336373515,0.0
pulpit,a platform raised above the surrounding level to give prominence to the person on it,7,-4.198738040013081,-4.1825109774860945,0.1428571428571429
cascade,"rush down in big quantities, like a cascade",4,-4.826275705057694,-4.947929389666461,0.0
quell,suppress or crush completely,3,-4.795540770741693,-4.711676593359897,0.0
minty,relating to or suggestive of mint,3,-5.261278757787355,-5.261278757787355,0.33333333333333337
newsstand,a stall where newspapers and other periodicals are sold,4,-4.515210180559244,-4.514522848628147,0.25
mauled,split (wood) with a maul and wedges,4,-5.107819089962865,-5.013966092420352,0.0
defected,"desert (a cause, a country or an army), often in order to join the opposing cause, country, or army",11,-4.121891962471081,-4.019191457228289,0.0
enacted,order by virtue of superior authority; decree,5,-4.694596709045474,-4.7675179376395755,0.0
pb,a soft heavy toxic malleable metallic element; bluish white when freshly cut but tarnishes readily to dull grey,14,-4.8117728655195595,-4.788956780897969,0.2142857142857143
borneo,3rd largest island in the world; in the western Pacific to the north of Java; largely covered by dense jungle and rain forest; part of the Malay Archipelago,16,-4.576331309030368,-4.43947963603622,0.125
ailment,an often persistent bodily disorder or disease; a cause for complaining,7,-4.838150670441185,-4.878986771347464,0.0
rodgers,United States composer of musical comedies (especially in collaboration with Oscar Hammerstein II and with Lorenz Hart) (1902-1979),11,-4.862608225664515,-4.9281679416794155,0.18181818181818177
dago,(ethnic slur) offensive term for a person of Italian descent,7,-4.770704476921394,-4.798408517667777,0.1428571428571429
sliver,a small thin sharp bit or wood or glass or metal,7,-4.185415820396512,-4.210576428542791,0.0
drivel,a worthless message,2,-4.461171567995152,-4.461171567995152,0.0
warhol,United States artist who was a leader of the Pop Art movement (1930-1987),7,-4.2177278380629755,-4.216130650989132,0.0
mouthpiece,a part that goes over or into the mouth of a person,4,-3.3636452060756845,-3.557640846967932,0.0
replenish,fill something that had previously been emptied,4,-4.011885275359034,-4.2902038188892995,0.0
commonplace,a trite or obvious remark,3,-4.876030259663948,-4.876030259663948,0.33333333333333337
